{"schema_version":"0.5.0","baseline_id":"CLIENT-BASELINE-ANDROID-EXAMPLE","project_id":"example-project","mode":"greenfield","platform":"android","status":"APPROVED","design_system":{"design_system_path":"templates/design-system.example.json","tokens_path":"templates/design-tokens.example.json"},"api_client":{"openapi_path":"tests/fixtures/artifact-graph/openapi.yaml","authorization_boundary":"api","error_contract":"RFC 9457 Problem Details","request_id_header":"X-Request-ID","idempotency_header":"Idempotency-Key"},"auth_lifecycle":{"mechanism":"bearer_jwt","access_credential_storage":"memory","refresh_credential_storage":"platform_secure_storage","refresh_enabled":true,"refresh_rotation":true,"concurrent_refresh_policy":"single_flight","unauthenticated_behavior":"Navigate to login and clear protected back stack.","forbidden_behavior":"Render permission state without exposing protected data.","logout_behavior":"Revoke refresh token and clear secure local credentials.","secrets_must_not_be_logged":true},"permissions":{"source":"api_contract","ui_hides_or_disables_unauthorized_actions":true,"api_remains_authoritative":true},"state_management":{"server_state_strategy":"Repository plus ViewModel observable server state.","ui_state_strategy":"ViewModel/SavedState for ephemeral screen state.","cache_strategy":"Explicit Room cache only for approved offline data."},"forms_validation":{"client_validation_strategy":"Local field validation mirrors contract constraints without redefining server rules.","api_validation_mapping":"Map 422 fields and Problem Details to Compose error state.","conflict_mapping":"Map 409 to explicit conflict resolution prompt.","rate_limit_mapping":"Map 429 to Retry-After guidance."},"observability":{"request_id_header":"X-Request-ID","client_error_strategy":"Attach request ID to sanitized crash/support context.","secret_redaction":true,"pii_policy":"Redact credentials and sensitive domain payloads."},"accessibility":{"target":"Android accessibility plus WCAG-equivalent interaction principles","keyboard_or_switch_navigation":"Support switch/keyboard traversal where applicable.","screen_reader_or_talkback":"TalkBack semantics and meaningful content descriptions.","focus_management":"Predictable focus after navigation, validation and dialogs.","min_touch_target_px":48},"testing":{"unit":{"required":true,"strategy":"Use-case, mapper and ViewModel unit tests."},"component_or_ui":{"required":true,"strategy":"Compose UI tests for states and accessibility semantics."},"integration":{"required":true,"strategy":"Repository/network/auth lifecycle integration tests."},"e2e":{"required":true,"strategy":"Critical slice journeys on emulator/device against real test API."}},"offline":{"mode":"queued_writes","storage_strategy":"Room stores only approved offline entities and explicit mutation queue.","sync_conflict_policy":"Server remains canonical; conflicts require documented merge/retry policy."},"implementation_guardrails":{"no_new_api_behavior":true,"no_auth_bypass":true,"approved_inventory_only":true,"high_risk_mutations_follow_idempotency":true,"no_hardcoded_authoritative_business_data":true},"android":{"language":"kotlin","ui_toolkit":"jetpack_compose","architecture_pattern":"MVVM with repository/use-case boundaries","networking_library":"Retrofit/OkHttp","local_persistence":"Room","background_work":"WorkManager","min_sdk":26}}