{"schema_version":"0.5.0","baseline_id":"CLIENT-BASELINE-WEB-EXAMPLE","project_id":"example-project","mode":"brownfield","platform":"web","status":"APPROVED","design_system":{"design_system_path":"templates/design-system.example.json","tokens_path":"templates/design-tokens.example.json"},"api_client":{"openapi_path":"tests/fixtures/artifact-graph/openapi.yaml","authorization_boundary":"api","error_contract":"RFC 9457 Problem Details","request_id_header":"X-Request-ID","idempotency_header":"Idempotency-Key"},"auth_lifecycle":{"mechanism":"bearer_jwt","access_credential_storage":"memory","refresh_credential_storage":"http_only_cookie","refresh_enabled":true,"refresh_rotation":true,"concurrent_refresh_policy":"single_flight","unauthenticated_behavior":"Redirect to login and preserve intended route.","forbidden_behavior":"Render an accessible 403 state without retry loops.","logout_behavior":"Revoke server refresh token and clear client auth state.","secrets_must_not_be_logged":true},"permissions":{"source":"api_contract","ui_hides_or_disables_unauthorized_actions":true,"api_remains_authoritative":true},"state_management":{"server_state_strategy":"TanStack Query owns API server state.","ui_state_strategy":"Component/local context owns ephemeral UI state.","cache_strategy":"Query-key cache with explicit stale times and slice-level invalidation rules."},"forms_validation":{"client_validation_strategy":"Schema-based validation for immediate feedback without redefining server business rules.","api_validation_mapping":"Map 422 field errors and Problem Details to accessible field/global errors.","conflict_mapping":"Map 409 to non-destructive conflict UI.","rate_limit_mapping":"Map 429 to retry guidance without automatic retry storms."},"observability":{"request_id_header":"X-Request-ID","client_error_strategy":"Attach request ID and route context to sanitized client error reports.","secret_redaction":true,"pii_policy":"Do not place secrets or sensitive payloads in telemetry."},"accessibility":{"target":"WCAG 2.2 AA","keyboard_or_switch_navigation":"All interactive flows operable by keyboard.","screen_reader_or_talkback":"Semantic labels and live regions for async feedback.","focus_management":"Move focus to validation/error summaries and restored dialogs intentionally.","min_touch_target_px":44},"testing":{"unit":{"required":true,"strategy":"Pure mapping/auth utility tests."},"component_or_ui":{"required":true,"strategy":"Component tests for permissions, forms and states."},"integration":{"required":true,"strategy":"API client/auth refresh/error mapping integration tests."},"e2e":{"required":true,"strategy":"Critical slice journeys against a real test API."}},"offline":{"mode":"degraded","storage_strategy":"No durable authoritative business writes offline; preserve safe UI draft state only.","sync_conflict_policy":"Refetch canonical server state before retrying mutations."},"implementation_guardrails":{"no_new_api_behavior":true,"no_auth_bypass":true,"approved_inventory_only":true,"high_risk_mutations_follow_idempotency":true,"no_hardcoded_authoritative_business_data":true},"web":{"framework":"react","rendering_mode":"SPA","router":"React Router","server_state_library":"TanStack Query","form_library":"React Hook Form","build_tool":"Vite","browser_support":"Current evergreen desktop/mobile browsers."},"brownfield":{"coexistence_required":true,"existing_client_path":"resources/views","migration_boundary":"Replace only explicitly accepted functional slices.","cutover_trigger":"Release approval for the replacement boundary.","rollback_strategy":"Restore existing route/view mapping.","remove_only_after_release_approval":true}}